Stock,Date,Time,Headlines
GOOG,Aug-20-23,02:55PM,Americas Tech Giants Rush to Comply With New Curbs in Europe
GOOG,Aug-19-23,07:04PM,Mohnish Pabrais 10 Biggest Investments in 10 Years
GOOG,Aug-18-23,08:50PM,UPDATE 2-California regulator probes crashes involving GM's Cruise robotaxis
GOOG,Aug-17-23,07:51PM,Netflix's Top Stories: Cloud Gaming and Stranger Things
GOOG,Aug-16-23,11:26PM,Alphabets Verily Plans Cost Cuts Amid Pressure on Other Bets to Rein In Spending
GOOG,Aug-15-23,06:01PM,"Google to train 20,000 Nigerians in digital skills"
GOOG,Aug-14-23,06:02PM,Bill Ackman's Q2 2023 13F Filing Update: Key Trades and Portfolio Overview
GOOG,Aug-13-23,10:51PM,Google-backed Anthropic raises $100 million from South Korea's SK Telecom
AMZN,Aug-20-23,02:35PM,Warren Buffetts 11 Growth Stock Picks
AMZN,Aug-19-23,11:15AM,2 Artificial Intelligence (AI) Growth Stocks That Could Join Apple Stock in the $3 Trillion Club by 2030
AMZN,Aug-18-23,07:10PM,Why Are Stocks Moving Lower?
AMZN,Aug-17-23,11:12PM,Q2 2023 Children's Place Inc Earnings Call
AMZN,Aug-16-23,08:42PM,Best Strong Buy Stocks for a Stock Picker's Market
AMZN,Aug-15-23,06:02PM,Winner Sells All Review: Battle of Bricks and Clicks
AAPL,Aug-20-23,04:23PM,10 Stocks ChatGPT Said Will Make Me Rich in 10 Years
AAPL,Aug-19-23,11:15AM,2 Artificial Intelligence (AI) Growth Stocks That Could Join Apple Stock in the $3 Trillion Club by 2030
AAPL,Aug-18-23,05:15PM,1 Top Tech Stock to Buy During a Recession
AAPL,Aug-17-23,06:21PM,Apple should buy ESPN from Disney: Analyst
AAPL,Aug-16-23,08:52PM,Apple's Stock Top Legal News Today: US iPhone Settlement and UK Encryption Controversies
AAPL,Aug-15-23,04:19PM,Norways $1.4 Trillion Wealth Fund Returns 10% on Tech Surge
AAPL,Aug-14-23,09:24PM,"Investors Look at Apple, Amazon, and More"
AAPL,Aug-13-23,07:11AM,"1 Magnificent Warren Buffett Stock That Turned $10,000 Into $68,000"
AAPL,Aug-12-23,03:09PM,Samsung Galaxy Z Flip 5 review: Foldables are here to stay
AAPL,Aug-11-23,09:00PM,Amazon Wants You to Pay With Your Palm. Its a Sneak Attack on Apple and Google.
MSFT,Aug-20-23,04:23PM,10 Stocks ChatGPT Said Will Make Me Rich in 10 Years
MSFT,Aug-19-23,09:41AM,"Got $5,000? Buy These 2 Stocks and Hold Until Retirement."
MSFT,Aug-18-23,02:55PM,Best Dow Jones Stocks To Buy And Watch In August 2023: Apple Reverses
MSFT,Aug-17-23,06:01PM,"Are AI job wages of up to $900,000 justified?"
MSFT,Aug-16-23,12:01PM,25 Countries that Give the Most Foreign Aid Per Capita
MSFT,Aug-15-23,04:19PM,Norways $1.4 Trillion Wealth Fund Returns 10% on Tech Surge
MSFT,Aug-14-23,08:41PM,Steven Cohen's Q2 2023 13F Filing Update: Top Trades and Portfolio Overview
MSFT,Aug-13-23,01:18PM,Goldman Sachs Tech Stocks: Top 12 Stock Picks
MSFT,Aug-12-23,12:05PM,Lina Khan: The most feared person in Big Tech is a 34-year-old in DC
MSFT,Aug-11-23,05:59PM,12 Undervalued Blue Chip Stocks To Buy According to Wall Street Analysts
MSFT,Aug-10-23,09:57PM,UPDATE 1-Microsoft's role in data breach part of US cyber inquiry -Bloomberg News
TSLA,Aug-20-23,09:00AM,Michael Burrys Top 10 Stock Picks For Q3
TSLA,Aug-19-23,12:48PM,"Tesla data breach affects 75,735 people, state attorney general announces"
TSLA,Aug-18-23,05:17PM,Tesla Stock Went Down Again for a New Reason. Heres Where Its Going.
TSLA,Aug-17-23,11:35PM,Elon Musk Arrives in Japan for First Visit in Nine Years
TSLA,Aug-16-23,08:00PM,EV Maker VinFast Bags Huge Valuation in SPAC-Mania Redux
TSLA,Aug-15-23,05:39PM,"Homebuilder sentiment falls, VinFast stock pops, Tesla's cheaper models: Top Stories"
NFLX,Aug-19-23,09:15AM,You Don't Have to Pick a Winner in Streaming. Here's Why
NFLX,Aug-18-23,11:30AM,Why Is Netflix (NFLX) Down 7.9% Since Last Earnings Report?
NFLX,Aug-17-23,07:51PM,Netflix's Top Stories: Cloud Gaming and Stranger Things
NFLX,Aug-16-23,08:02PM,Netflix has a troubling new problem on its hands
NFLX,Aug-15-23,03:11PM,Traditional TV 'past the point of no return' as viewership hits record low
NFLX,Aug-14-23,05:12PM,"Netflix's launches video game streaming service beta for Canada, U.K. users"
NFLX,Aug-13-23,06:05AM,CEO Bob Iger's 3 Big Gambits Could Spell Trouble for Disney
NFLX,Aug-12-23,09:00AM,Hollywood calls time on golden era of cheap streaming
NFLX,Aug-11-23,10:55PM,Hollywood writers to evaluate counterproposal from studios
NFLX,Aug-10-23,05:09PM,NFL to raise prices of streaming packages
NFLX,Aug-09-23,07:38PM,Disney hints at upcoming streaming password sharing crackdown
NFLX,Aug-08-23,04:20PM,"Paramount earnings: Streamers' growth is 'certainly slowing,' analyst explains"
NFLX,Aug-07-23,04:48PM,"Paramount stock pops on earnings, KKR to buy Simon & Schuster"
NFLX,Aug-04-23,05:02PM,3 New Additions to the Zacks Rank Investors Cannot Miss
NFLX,Aug-03-23,04:10PM,Soundstages Were Already Reeling Before This Summer of Strikes. Now What?
NFLX,Aug-02-23,08:23AM,Will Spotify Ever Turn a Profit?
NFLX,Aug-01-23,09:29AM,"Company News for Aug 1, 2023"
NFLX,Jul-31-23,11:14AM,"Netflix Makes a Change to Its Controversial $900,000 Job Posting"
NFLX,Jul-30-23,11:27AM,"3 Reasons to Buy Roku Stock, and 1 Reason to Sell"
NFLX,Jul-29-23,12:58AM,Heres What Makes Netflix (NFLX) a Worthy Investment
NFLX,Jul-28-23,09:00PM,How Netflixs Algorithms and Tech Feed Its Success
NFLX,Jul-27-23,10:46PM,RPT-Disney's Hotstar India streaming service plans to limit account sharing -sources
META,Aug-20-23,02:55PM,Americas Tech Giants Rush to Comply With New Curbs in Europe
META,Aug-19-23,11:47AM,Its Not Too Late: Heres How to Get In on the $725 Million Facebook Settlement.
META,Aug-18-23,06:15PM,Facebook delivers a hard-nosed warning to its workers
META,Aug-16-23,10:30AM,Nvidia's earnings will be the AI hype cycles biggest test
META,Aug-15-23,07:58PM,"Musk's X delays access to content on Reuters, NY Times, social media rivals"
META,Aug-14-23,06:32PM,Biographer Walter Isaacson Discusses Elon Musk's Leadership Style and Role Model
META,Aug-13-23,03:55PM,25 Countries with Most Instagram Users in 2023
META,Aug-12-23,12:05PM,Lina Khan: The most feared person in Big Tech is a 34-year-old in DC
META,Aug-11-23,03:56PM,Musk vs. Zuckerberg: Tech CEOs post updates on likelihood of a fight
META,Aug-10-23,06:57PM,The Chan Zuckerberg Initiative Lays Off Dozens Amid Meta's Cost-Cutting Push
META,Aug-09-23,04:32PM,Is Aptos the New Way to Play the AI Boom?
META,Aug-08-23,05:33PM,"Zoom, Other Remote-Work Champions Call Employees Back to the Office"
META,Aug-07-23,05:43PM,Palantir announces $1B buyback program as Q2 earnings meet expectations
GME,Aug-18-23,06:21AM,"Meme stocks ride on, though investors more cautious than GameStop era"
GME,Aug-17-23,02:36PM,"'Another Meme Bites The Dust': After AMC's Crash, Bond King Bill Gross Warns That GameStop Is Next  Here's His Best Value Stock Pick"
GME,Aug-15-23,02:19PM,"GameStop (GME) Loses -12.53% in 4 Weeks, Here's Why a Trend Reversal May be Around the Corner"
GME,Aug-14-23,10:47PM,"James Surowiecki Joins Us to Talk About Crypto, Meme Stocks, and Movies"
GME,Aug-08-23,09:00AM,This Fellow Has No Interest in Yellow or Any Other Meme Stock
GME,Aug-02-23,05:03PM,GameStop to End Support of Its Crypto Wallet
GME,Aug-01-23,04:59PM,"GameStops quest for relevancefollowing meme-stock madnesswont include crypto wallets, which its ending amid regulatory uncertainty"
GME,Jul-28-23,06:31AM,Intel Earnings Show the AI Boom Isnt Everything. Why Thats Good for Apple.
GME,Jul-27-23,04:30PM,GameStop CFO to quit in second top executive exit in two months
GME,Jul-21-23,03:59PM,Meta Materials Exposes the Dangers of Meme Stock Investing
GME,Jul-20-23,07:45AM,Passport King Builds Quant Trading Fortune
GME,Jul-17-23,05:00AM,"The Zacks Analyst Blog Highlights BJ's Restaurants, Salesforce, Alphabet, Tesla and GameStop"
GME,Jul-16-23,12:29PM,7 Doomed Meme Stocks Destined for Disaster
GME,Jul-14-23,01:19PM,Caution! Dont Get Greedy With These 3 Growth Stocks.
GME,Jul-12-23,12:22PM,3 Doomed Gaming Stocks Destined for Disaster
GME,Jul-11-23,07:01AM,Exiting the Game: Is It Time to Consider Selling GameStop Stock?
GME,Jul-10-23,10:02AM,GameStop Gloom: Why the Bullish Thesis for GME Stock Falls Short
GME,Jul-07-23,11:30AM,Why Is GameStop (GME) Up 6.5% Since Last Earnings Report?
GME,Jul-05-23,06:00AM,7 Meme Stocks to Sell in July Before They Crash and Burn
GME,Jul-04-23,05:07PM,3 Meme Stocks to Sell Before They Do Your Portfolio In
GME,Jul-03-23,09:49PM,7 Dead-End Stocks to Sell Before They Dive
GME,Jun-28-23,03:21PM,Hold Your Joysticks: Why Cohens $10M GameStop Buy Is Not Game-On
GME,Jun-21-23,08:00PM,GME: Lowering target price to $20.00
GME,Jun-20-23,08:38AM,3 Stocks to Short Before They Sink 75% (or More!)
GME,Jun-19-23,08:45AM,Cut Your Losses: Say Goodbye to These 3 Struggling Stocks
GME,Jun-18-23,05:12PM,"3 Meme Stocks to Sell before You Lose Your Shirt, Shorts and Shoes"
GME,Jun-17-23,08:15AM,What's Going On With Commercial Real Estate and Regional Banking?
GME,Jun-15-23,01:09PM,Ryan Cohen Rails Against Corporate America at GameStops Annual Meeting
GME,Jun-14-23,07:30PM,The Meme Stock Frenzy is Over: Sell These Seven Now
GME,Jun-13-23,05:43PM,Meme Stock GameStop Just Did Something Impressive
GME,Jun-12-23,12:23PM,GameStop Stock Rallies After Two Directors Bought Shares
GME,Jun-10-23,09:00AM,GameStop Needs Ryan Cohen More Than Ever to Maintain Meme Status
GME,Jun-09-23,11:08AM,Why this market rally is different from the meme trade boom
GME,Jun-08-23,05:21PM,"East Coast smoke, GameStop plummets, Tesla-GM partnership: Top stories"
PANW,Aug-20-23,07:30AM,Palo Alto Networks (PANW) Q4 2023 Earnings Call Transcript
PANW,Aug-19-23,01:00PM,Q4 2023 Palo Alto Networks Inc Earnings Call
PANW,Aug-18-23,06:00PM,"Compared to Estimates, Palo Alto (PANW) Q4 Earnings: A Look at Key Metrics"
PANW,Aug-17-23,05:12PM,"Palo Alto earnings, Estée Lauder, Biden's Camp David meetings: What to watch"
PANW,Aug-16-23,10:13AM,Palo Alto Networks Prisma SASE Recognized as a Leader in Zero Trust Edge Solutions
PANW,Aug-15-23,01:34PM,Palo Alto (PANW) to Report Q4 Earnings: What's in the Offing?
PANW,Aug-14-23,04:19PM,Eiger BioPharma: Q2 Earnings Snapshot
PANW,Aug-13-23,10:30AM,Bearish Bets: 3 Stocks You Really Should Think About Shorting This Week
PANW,Aug-11-23,06:05PM,"Stock Market Action Plan: Walmart, Target, Home Depot Lead Crucial Week For Retail"
PANW,Aug-10-23,05:45PM,Palo Alto Networks (PANW) Outpaces Stock Market Gains: What You Should Know
PANW,Aug-09-23,04:26PM,AppLovin: Q2 Earnings Snapshot
PANW,Aug-08-23,07:21AM,Is It Too Late to Buy Fortinet Stock?
PANW,Aug-07-23,05:43PM,10 Best Cybersecurity ETFs
PANW,Aug-04-23,04:32PM,Todays Biggest S&P 500 Loser Wasnt a Household Name. It Dragged Down IT Stocks Anyhow
PANW,Aug-02-23,08:30AM,"Palo Alto Networks to Announce Fiscal Fourth Quarter and Fiscal Year 2023 Financial Results on Friday, August 18, 2023"
PANW,Aug-01-23,09:47AM,Top Stocks From Our Screens: Growth Leaders That Stand Out
PANW,Jul-29-23,11:34AM,10 Stocks That Will Make You Rich in 2023
PANW,Jul-28-23,12:41PM,"The Best Stocks to Invest $50,000 In Right Now"
PANW,Jul-27-23,07:00AM,"Palo Alto Networks Introduces CI/CD Security, Becoming the First CNAPP to Extend Security into the Software Delivery Pipeline"
PANW,Jul-26-23,05:36AM,3 Cybersecurity Stocks You Better Be Buying on Each and Every Dip
PANW,Jul-25-23,04:30PM,Will Palo Alto Networks Stock's Recent Rally Find A Second Wind?
PANW,Jul-24-23,05:45PM,Palo Alto Networks (PANW) Stock Sinks As Market Gains: What You Should Know
PANW,Jul-23-23,07:10AM,3 Things About Microsoft Stock That Smart Investors Know
PANW,Jul-21-23,05:10AM,Better Cybersecurity Stock: Palo Alto Networks vs. Rapid7
PANW,Jul-18-23,05:45PM,Palo Alto Networks (PANW) Stock Sinks As Market Gains: What You Should Know
PANW,Jul-17-23,09:00AM,"Investors Heavily Search Palo Alto Networks, Inc. (PANW): Here is What You Need to Know"
PANW,Jul-16-23,06:06PM,Why These 3 Stocks Are the Best Ways to Play Cybersecurity Right Now
PANW,Jul-14-23,08:17AM,5 Top Stocks to Tap the Steady Fall in Inflation Rate
PANW,Jul-13-23,05:55PM,3 Stocks to Buy for Artificial Intelligence (AI) Exposure
PANW,Jul-12-23,06:18PM,Why Cloudflare and Palo Alto Networks Shares Got Crushed Today
PANW,Jul-11-23,05:45PM,Palo Alto Networks (PANW) Outpaces Stock Market Gains: What You Should Know
PANW,Jul-09-23,08:30AM,3 Stocks Poised to Dominate the Second Half of 2023
PANW,Jul-07-23,09:44AM,"The Zacks Analyst Blog Highlights NVIDIA, Palo Alto Networks, Celsius Holdings, Lennar and Kimberly-Clark"
PANW,Jul-06-23,10:54AM,PayPal (PYPL) Unveils Tap to Pay for Venmo and Zettle Users
PANW,Jul-05-23,05:45PM,Palo Alto Networks (PANW) Gains As Market Dips: What You Should Know
BUD,Aug-19-23,01:34PM,Bud Light appears to have an unlikely new supporter
BUD,Aug-18-23,03:15PM,Boycotts Hurt Target and Bud Light Sales. Why Theyll Likely Ebb Soon.
BUD,Aug-17-23,06:12PM,"UPDATE 1-Mexico's Grupo Modelo, Millfoods to partner on new corn plant"
BUD,Aug-16-23,04:58PM,"Target, Much Like Bud Light, Is Stung by Culture Wars"
BUD,Aug-15-23,11:42AM,20 Countries with Highest Rates of Alcoholism
BUD,Aug-14-23,06:01PM,Bill Gates' Q2 2023 Investment Moves: A Deep Dive
BUD,Aug-12-23,08:02AM,"Molson Coors, Tilray search for next billion-dollar idea in recent booze deals"
BUD,Aug-11-23,09:08PM,Why Tilray Brands Stock Soared 14% This Week
BUD,Aug-10-23,02:02PM,Bud Light U.S. Sales Are Down. The Rest of the World Is Buying AB InBev Brands.
BUD,Aug-09-23,05:41AM,"Anheuser-Busch selling Shock Top, Breckinridge to cannabis company Tilray"
BUD,Aug-08-23,06:28PM,"Bud Light May Never Recover From The Controversy That Cost $400 Million In Lost US Sales   'They Want To Enjoy Their Beer Without A Debate,' Anheuser-Busch CEO Says"
BUD,Aug-07-23,05:22PM,"Anheuser-Busch Selling Shock Top, Blue Point to Cannabis Company Tilray"
BUD,Aug-05-23,01:50PM,Joe Rogan's Surprise Stand On Bud Light Has Megyn Kelly Furious
BUD,Aug-04-23,07:09PM,Anheuser-Busch InBev SA/NV (NYSE:BUD) Q2 2023 Earnings Call Transcript
BUD,Aug-03-23,05:33PM,Analyst Report: Anheuser-Busch InBev SA/NV
BUD,Aug-02-23,05:58PM,Bud Light Parent AB InBev Reports Earnings Soon. What Wall Street Expects.
BUD,Aug-01-23,05:59PM,Bud Light's woes become Molson Coors' gain
BUD,Jul-31-23,05:22PM,Molson Coors Results On Tap; AB InBev To Nurse Hangover From Bud Light Boycott
BUD,Jul-28-23,04:50PM,25 Most Popular Whiskey Brands in the World
WMT,Aug-20-23,11:32AM,Walmart has 'upper hand' versus Target in this key area: Analyst
WMT,Aug-19-23,01:33PM,Target and Walmart have a warning for shoppers
WMT,Aug-18-23,03:47PM,Save at the Pump Using Walmart+ Gas Discount
WMT,Aug-17-23,11:03PM,5 big earnings hits: Analysts wary after Cisco's beat; retailers a mixed bag
WMT,Aug-16-23,06:34PM,Q2 Earnings Confirm Improving Growth Trends
W,Aug-17-23,07:30AM,Can Wayfair Ride the Wave of AI in the Next Market Rally?
W,Aug-16-23,03:12PM,15 Best Performing Stocks in the Last 3 Months
W,Aug-15-23,03:58PM,Why Investors Need to Take Advantage of These 2 Retail-Wholesale Stocks Now
W,Aug-14-23,01:26PM,Consumer worries: Why the second half of the year could be rough for retailers
W,Aug-11-23,12:41PM,Wayfairs Investor Day Has Analysts Feeling Bullish
W,Aug-10-23,06:44PM,Analyst Report: Wayfair Inc.
W,Aug-08-23,07:45AM,Did Wayfair Just Pull Off the Turnaround of the Year?
W,Aug-07-23,01:28PM,Wayfair Stock Edges Higher. Theres a New Bull on Wall Street.
W,Aug-04-23,11:35PM,15 Countries with the Most IKEA Stores Worldwide in 2023
W,Aug-03-23,11:16PM,Q2 2023 Wayfair Inc Earnings Call
W,Aug-01-23,04:34PM,Earnings season winners: Consumer discretionary stocks
W,Jul-31-23,05:25PM,PetMed (PETS) Reports Break-Even Earnings for Q1
W,Jul-28-23,10:00AM,"2 Reasons to Sell Wayfair Stock, and 1 Reason to Buy"
W,Jul-25-23,07:36PM,Wayfairs Chief People Officer Named to Fill Top Marketing Role
W,Jul-24-23,09:41AM,2 Growth Stocks to Buy Before the Next Bull Market
W,Jul-19-23,09:53AM,"Wayfair Stock: Buy, Sell, or Hold?"
W,Jul-17-23,07:41AM,Where Will Wayfair Be in 5 Years?
W,Jul-15-23,10:00AM,Where Will Wayfair Stock Be in 1 Year?
W,Jul-14-23,09:35AM,Wayfair Inc. (NYSE:W) Looks Just Right With A 37% Price Jump
W,Jul-12-23,10:07AM,1 Red Flag for Wayfair Stock in 2023
W,Jul-09-23,07:25AM,4 Short-Squeeze Stocks Up 78% to 250% and Looking for More
W,Jul-07-23,02:02PM,Why Wayfair Stock Jumped 61% in June
W,Jul-06-23,04:49PM,Why Wayfair Shares Tanked Today
W,Jul-05-23,11:34AM,Analyst Report: Wayfair Inc.
W,Jul-03-23,08:05AM,Weekly Stock List
W,Jul-02-23,08:30AM,"These 2 Super-Cheap Stocks Could Lead to Incredible Gains, but They're Risky"
W,Jul-01-23,11:05AM,Wayfair CEO: AI is helping our human customer service agents 'outperform'
W,Jun-29-23,07:00AM,Wayfair Schedules Second Quarter 2023 Earnings Release and Conference Call; Announces Investor Day Event
W,Jun-28-23,10:09AM,Pinterest stocks moves higher on analyst upgrade
W,Jun-26-23,12:56PM,12 Most Undervalued Retail Stocks to Buy According to Hedge Funds
W,Jun-23-23,12:28PM,"CarMax earnings, Starbucks union, Wayfair upgrade, Nikola truck fire: Trending stocks"
W,Jun-22-23,11:55AM,These 3 No-Brainer Stocks Are Leading the Market This Quarter. Can You Still Buy?
W,Jun-17-23,09:06AM,Wayfair Inc. (NYSE:W) Shares Could Be 50% Below Their Intrinsic Value Estimate
W,Jun-14-23,07:00AM,Wayfair Releases Corporate Responsibility Report
W,Jun-09-23,09:53AM,Where Will Wayfair Stock Be In 3 Years?
W,Jun-07-23,02:19PM,"Wayfair Stock Clears Key Benchmark, Hitting 80-Plus RS Rating"
W,May-31-23,06:44PM,Analyst Report: Wayfair Inc.
W,May-30-23,12:08PM,Wayfair stock surges after being added to JPMorgan 'analyst focus' list
W,May-26-23,08:30AM,"Wayfair: Buy, Sell, or Hold?"
W,May-24-23,08:55AM,Prediction: These 2 Struggling Stocks Won't Survive a Recession
W,May-23-23,08:54AM,A Bull Market Is Coming: 3 Reasons to Buy Wayfair Stock
W,May-19-23,07:03AM,The 3 Best Stocks to Short in May 2023
W,May-16-23,10:05AM,3 Things About Wayfair That Smart Investors Know
W,May-12-23,02:00PM,"JCPenney, Wayfair and 14 Other Retailers Charging Return Fees"
W,May-11-23,08:54PM,Q1 2023 Katapult Holdings Inc Earnings Call
W,May-10-23,07:45AM,Wayfair Burns Cash as Customers Flee
W,May-08-23,04:30PM,Wayfair Inc. Announces Proposed Offering of $600 million Convertible Senior Notes
W,May-06-23,07:45AM,1 E-Commerce Stock You Might Want to Run Far Away from
W,May-05-23,01:53PM,"Wayfair (W) Q1 Loss Narrower Than Expected, Revenues Decline Y/Y"
W,May-04-23,03:55PM,Analyst Report: Wayfair Inc.
NVDA,Aug-20-23,04:23PM,10 Stocks ChatGPT Said Will Make Me Rich in 10 Years
NVDA,Aug-19-23,10:05AM,"What Nvidia, Intel, AMD, and TSMC Stock Investors Should Know About Recent Chip Updates"
NVDA,Aug-18-23,07:10PM,Why Are Stocks Moving Lower?
NVDA,Aug-17-23,06:01PM,"Are AI job wages of up to $900,000 justified?"
NVDA,Aug-16-23,09:02PM,NVIDIA's Top Stories: How It's Beating Competition in AI in US and Overseas
NVDA,Aug-15-23,05:19PM,Nvidia price target raised by analysts ahead of earnings
